{
  "format": "twin-studio-project",
  "packageVersion": 1,
  "exportedAt": "2026-09-22T16:16:24.020Z",
  "project": {
    "id": "sdk-assets-1790093783620",
    "name": "SDK Asset Fixture",
    "createdAt": "2026-09-22T16:16:23.620Z",
    "updatedAt": "2026-09-22T16:16:23.620Z"
  },
  "scene": {
    "path": "scene.json",
    "sha256": "84f608aba10041daa09738eb3a6c9e34c49ad955c2bbd8e1f36a5d531c09f8d2"
  },
  "assets": [
    {
      "id": "asset_0face34b-b0de-4624-bb7d-6bf4b4ae8b6e",
      "path": "assets/0.glb",
      "name": "sdk-cabinet.glb",
      "mimeType": "model/gltf-binary",
      "assetType": "model",
      "size": 688,
      "sha256": "d80426176d0d7c1caac2448a9e0e2320534b3f096abcac42adf3452241c3200b",
      "lastModified": 1790093783862,
      "createdAt": "2026-09-22T16:16:23.863Z"
    },
    {
      "id": "asset_2cef01cc-cd7b-4ddc-8c84-ec18dba766c5",
      "path": "assets/1.hdr",
      "name": "sdk-environment.hdr",
      "mimeType": "image/vnd.radiance",
      "assetType": "environment",
      "size": 61,
      "sha256": "e716ed098b8038eb33edde30da2bd45bf7364c26b83526fa24a1ae54a31306ab",
      "lastModified": 1790093783946,
      "createdAt": "2026-09-22T16:16:23.946Z"
    }
  ]
}
